{
  "id": "p-yeongho",
  "projectId": "sample",
  "name": "영호, 48, 꽃집 사장님",
  "summary": "응답 패턴이 거의 겹치는 세 사람(P3·P11·P19)을 하나로 묶은 페르소나이며, 중심은 P3다. 세 사람 모두 지도에서 하는 일로 '길찾기' 하나만 골랐고(q3), 낯선 동네에서 주변을 살피는 일은 잦지 않다고 답했다(q2 1~2점). 그런데도 '정보가 복잡해 원하는 것만 보기 어렵다'에는 4점을 줬다(q4). 기능을 많이 써 봐서 불만인 게 아니라, 더 써 보기 전에 화면 앞에서 물러선 사람들이다.",
  "basis": "cluster",
  "sourceSurveyIds": ["sv-sample"],
  "sourceRespondents": [
    { "surveyId": "sv-sample", "respondentLabel": "P3", "role": "primary" },
    { "surveyId": "sv-sample", "respondentLabel": "P11", "role": "supporting" },
    { "surveyId": "sv-sample", "respondentLabel": "P19", "role": "supporting" }
  ],
  "clusterSize": 3,
  "populationNote": "35명 중 12명이 'q3에서 길찾기만 선택 + q2 2점 이하' 패턴에 해당한다. 그중 자유 의견(q5)까지 남겨 대조가 가능한 3명을 묶었다.",

  "answerProfile": {
    "surveyId": "sv-sample",
    "respondentLabel": "P3",
    "answers": [
      {
        "questionId": "q1",
        "questionText": "연령대를 알려주세요.",
        "answer": "40대",
        "readAs": "35명 중 9명인 40대. 묶인 세 사람 모두 40대 이상이다(P11 40대, P19 50대 이상)."
      },
      {
        "questionId": "q2",
        "questionText": "낯선 동네에서 내 위치 주변 정보를 확인하는 일이 잦다.",
        "answer": 2,
        "readAs": "낮은 점수. 지도를 여는 계기가 '둘러보기'가 아니라 '가야 할 곳이 생겼을 때'로 한정된다."
      },
      {
        "questionId": "q3",
        "questionText": "지도 앱에서 주로 하는 일을 모두 골라주세요.",
        "answer": ["길찾기"],
        "readAs": "4개 중 1개만 선택. 다른 기능을 안 쓰는 게 아니라 있는지도 모를 가능성이 크다 — 선택 하나로는 구분되지 않으므로 단정하지 않는다."
      },
      {
        "questionId": "q4",
        "questionText": "지도 앱의 정보가 복잡해서 원하는 것만 보기 어렵다.",
        "answer": 4,
        "comment": "버튼이 여러 개 뜨면 어느 걸 눌러야 할지 몰라서 그냥 닫습니다.",
        "readAs": "높은 점수인데 정작 쓰는 기능은 하나뿐이다(q3). 복잡함이 불만 제기가 아니라 '포기'로 이어지는 유형임을 의견이 확인해 준다."
      },
      {
        "questionId": "q5",
        "questionText": "지도 앱을 쓰다가 가장 불편했던 순간을 알려주세요.",
        "answer": "걷는 중에 한 손으로 조작하기 어려움",
        "readAs": "앉아서 계획하는 사용이 아니라 이동 중 한 손 사용이다. 버튼 크기와 터치 영역이 곧바로 성패를 가른다."
      }
    ],
    "contradictions": [
      "'정보가 복잡해 원하는 것만 보기 어렵다'에 4점을 주면서(q4), 정작 쓰는 기능은 길찾기 하나뿐이라고 답했다(q3). 복잡함을 겪어서 불만인 게 아니라, 복잡해 보여서 더 안 써 본 결과일 수 있다. 데모에서는 '어렵다'고 말하기 전에 조용히 손을 멈추는 쪽으로 나타난다."
    ]
  },

  "demographics": {
    "age": "40대 (q1 응답)"
  },

  "traits": [
    {
      "text": "지도는 목적지가 생겼을 때만 여는 도구다. 그냥 둘러보려고 열지는 않는다.",
      "evidence": [
        {
          "surveyId": "sv-sample",
          "questionId": "q2",
          "respondentLabel": "P3",
          "quote": "2 — 그렇지 않은 편",
          "populationContext": "35명 중 2점 이하는 7명 (전체 평균 3.5점)"
        },
        {
          "surveyId": "sv-sample",
          "questionId": "q2",
          "respondentLabel": "P19",
          "quote": "1 — 전혀 그렇지 않다"
        }
      ]
    },
    {
      "text": "사용하는 기능이 사실상 길찾기 하나다. 나머지는 화면에 있어도 손이 가지 않는다.",
      "evidence": [
        {
          "surveyId": "sv-sample",
          "questionId": "q3",
          "respondentLabel": "P3",
          "quote": "'길찾기'만 선택",
          "populationContext": "35명 중 31명이 길찾기를 골랐지만, 길찾기 '하나만' 고른 사람은 12명"
        },
        {
          "surveyId": "sv-sample",
          "questionId": "q3",
          "respondentLabel": "P19",
          "quote": "'길찾기'만 선택"
        }
      ]
    },
    {
      "text": "무엇을 가져가는지 모르는 요청이 뜨면 손을 멈춘다. 거부보다 '멈춤'에 가깝다.",
      "evidence": [
        {
          "surveyId": "sv-sample",
          "questionId": "q5",
          "respondentLabel": "P11",
          "quote": "위치 권한 요청이 무섭게 느껴질 때가 있다"
        }
      ]
    }
  ],

  "goals": [
    {
      "text": "가야 할 곳까지 헤매지 않고 한 번에 도착하는 것. 그 이상은 요구하지 않는다.",
      "evidence": [
        {
          "surveyId": "sv-sample",
          "questionId": "q3",
          "respondentLabel": "P3",
          "quote": "'길찾기'만 선택"
        },
        {
          "surveyId": "sv-sample",
          "questionId": "q2",
          "respondentLabel": "P3",
          "quote": "2 — 그렇지 않은 편"
        }
      ]
    },
    {
      "text": "걸으면서 한 손으로도 눌리는 크기였으면 좋겠다.",
      "evidence": [
        {
          "surveyId": "sv-sample",
          "questionId": "q5",
          "respondentLabel": "P3",
          "quote": "걷는 중에 한 손으로 조작하기 어려움"
        }
      ]
    }
  ],

  "painPoints": [
    {
      "text": "이동 중 한 손 조작이 어렵다. 버튼이 작거나 화면 위쪽에 있으면 사실상 못 누른다.",
      "evidence": [
        {
          "surveyId": "sv-sample",
          "questionId": "q5",
          "respondentLabel": "P3",
          "quote": "걷는 중에 한 손으로 조작하기 어려움"
        }
      ]
    },
    {
      "text": "화면에 선택지가 여러 개면 어디를 눌러야 할지 몰라 그냥 닫는다. 불만을 말하는 대신 사라진다.",
      "evidence": [
        {
          "surveyId": "sv-sample",
          "questionId": "q4",
          "respondentLabel": "P3",
          "quote": "4 — 그런 편 · \"버튼이 여러 개 뜨면 어느 걸 눌러야 할지 몰라서 그냥 닫습니다.\"",
          "populationContext": "35명 중 4점 이상은 16명"
        }
      ]
    },
    {
      "text": "이유를 알려주지 않는 위치 권한 요청 앞에서 불안해진다.",
      "evidence": [
        {
          "surveyId": "sv-sample",
          "questionId": "q5",
          "respondentLabel": "P11",
          "quote": "위치 권한 요청이 무섭게 느껴질 때가 있다"
        }
      ]
    }
  ],

  "behaviorModel": {
    "firstMoves": [
      {
        "text": "화면이 뜨면 아무것도 누르지 않고 몇 초 본다. 먼저 목적지를 넣을 칸이 어디인지부터 찾는다.",
        "evidence": [
          {
            "surveyId": "sv-sample",
            "questionId": "q3",
            "respondentLabel": "P3",
            "quote": "'길찾기'만 선택"
          },
          {
            "surveyId": "sv-sample",
            "questionId": "q2",
            "respondentLabel": "P3",
            "quote": "2 — 그렇지 않은 편"
          }
        ]
      },
      {
        "text": "권한 팝업이 뜨면 손을 멈춘다. 왜 필요한지 적혀 있으면 허용하고, 없으면 한 번 더 망설인 뒤 누른다.",
        "evidence": [
          {
            "surveyId": "sv-sample",
            "questionId": "q5",
            "respondentLabel": "P11",
            "quote": "위치 권한 요청이 무섭게 느껴질 때가 있다"
          }
        ]
      },
      {
        "text": "목적지 입력칸이 안 보이면 화면을 두어 번 훑고, 그래도 없으면 더 시도하지 않고 멈춘다.",
        "evidence": [
          {
            "surveyId": "sv-sample",
            "questionId": "q4",
            "respondentLabel": "P3",
            "quote": "4 — 그런 편 · \"버튼이 여러 개 뜨면 어느 걸 눌러야 할지 몰라서 그냥 닫습니다.\""
          }
        ]
      }
    ],
    "decisionDrivers": [
      {
        "text": "이 화면이 '가는 데' 도움이 되는가 하나만 본다. 그 외 기능은 있어도 판단에 넣지 않는다.",
        "evidence": [
          {
            "surveyId": "sv-sample",
            "questionId": "q3",
            "respondentLabel": "P3",
            "quote": "'길찾기'만 선택"
          },
          {
            "surveyId": "sv-sample",
            "questionId": "q3",
            "respondentLabel": "P19",
            "quote": "'길찾기'만 선택"
          }
        ]
      },
      {
        "text": "걸어가면서도 글자가 읽히고 버튼이 눌리는가. 확대를 여러 번 해야 하면 쓸 물건이 아니라고 본다.",
        "evidence": [
          {
            "surveyId": "sv-sample",
            "questionId": "q5",
            "respondentLabel": "P3",
            "quote": "걷는 중에 한 손으로 조작하기 어려움"
          }
        ]
      },
      {
        "text": "무엇을 왜 가져가는지 먼저 말해 주는가. 설명이 있으면 경계가 풀린다.",
        "evidence": [
          {
            "surveyId": "sv-sample",
            "questionId": "q5",
            "respondentLabel": "P11",
            "quote": "위치 권한 요청이 무섭게 느껴질 때가 있다"
          }
        ]
      }
    ],
    "dealBreakers": [
      {
        "text": "설명 없이 튀어나오는 위치 권한 요청. 여기서 멈추면 그 뒤 화면은 보지 않는다.",
        "evidence": [
          {
            "surveyId": "sv-sample",
            "questionId": "q5",
            "respondentLabel": "P11",
            "quote": "위치 권한 요청이 무섭게 느껴질 때가 있다"
          }
        ]
      },
      {
        "text": "첫 화면에 눌러야 할 것이 여러 개면 고르지 못하고 그대로 닫는다. 항의도 문의도 없이 이탈한다.",
        "evidence": [
          {
            "surveyId": "sv-sample",
            "questionId": "q4",
            "respondentLabel": "P3",
            "quote": "4 — 그런 편 · \"버튼이 여러 개 뜨면 어느 걸 눌러야 할지 몰라서 그냥 닫습니다.\"",
            "populationContext": "35명 중 4점 이상 16명 — 이 묶음에서는 불만이 아니라 이탈로 나타난다"
          }
        ]
      },
      {
        "text": "작은 글씨와 좁은 터치 영역. 걸으면서 두 손을 써야 하는 순간 사용을 포기한다.",
        "evidence": [
          {
            "surveyId": "sv-sample",
            "questionId": "q5",
            "respondentLabel": "P3",
            "quote": "걷는 중에 한 손으로 조작하기 어려움"
          }
        ]
      }
    ],
    "successMoment": {
      "text": "목적지를 넣자마자 큰 글씨로 경로가 뜨고, 그 뒤로는 아무것도 더 누르지 않아도 되는 순간. '이건 나도 쓰겠다'는 판단이 여기서 난다.",
      "evidence": [
        {
          "surveyId": "sv-sample",
          "questionId": "q3",
          "respondentLabel": "P3",
          "quote": "'길찾기'만 선택"
        },
        {
          "surveyId": "sv-sample",
          "questionId": "q5",
          "respondentLabel": "P3",
          "quote": "걷는 중에 한 손으로 조작하기 어려움"
        }
      ]
    },
    "comparisonAnchors": ["티맵", "네이버 지도", "카카오맵"],
    "effortTolerance": "low",
    "helpSeeking": "often"
  },

  "techProfile": {
    "savviness": "low",
    "device": "갤럭시 A34 (360x780), 글자 크게 설정",
    "network": "normal"
  },

  "voice": {
    "tone": "정중하고 담담한 존댓말. 불만도 상황 설명으로만 말하고 누구를 탓하지 않는다.",
    "verbosity": "terse",
    "ratingBias": "generous",
    "sampleQuote": "걷는 중에 한 손으로 조작하기 어려움"
  },

  "confidence": {
    "level": "mid",
    "answeredRatio": 1,
    "gaps": [
      "중심 응답자 P3는 5문항에 모두 답했고(5/5) 같은 패턴의 응답자 2명이 뒷받침하지만, 문항이 5개뿐이라 세부는 여전히 얇다.",
      "권한에 대한 불안은 P3가 아니라 P11의 자유 의견에서 왔다(q5). 같은 묶음이라는 이유로 P3에게 옮겨 붙인 특성이므로, P3 본인이 그렇게 말한 적은 없다.",
      "'길찾기만 고름'이 다른 기능을 싫어해서인지 존재를 몰라서인지 서베이로는 구분되지 않는다. 후자로 가정했다.",
      "helpSeeking(막히면 도움을 찾는다)은 직접 묻는 문항이 없다. q4 의견의 '몰라서 그냥 닫습니다'와 낮은 테크 능숙도에서 추론한 값이다.",
      "직업·거주지·가구 구성은 서베이에 문항이 없다. 이름의 '48, 꽃집 사장님'은 호칭용 설정이며 응답으로 확인된 사실이 아니다 — demographics에는 q1의 연령대만 넣었다.",
      "ratingBias(별점 후함)는 응답에서 확인할 수 없다. 불만을 완곡하게 적는 말투에서 추정했다."
    ]
  },

  "version": 2,
  "revisionNote": "v2 — 문항별 집계로 만든 '라이트유저 클러스터 대표'를 폐기하고, 실제 응답자 P3(중심)·P11·P19의 답변에서 다시 세웠다. 중심 응답자의 응답 프로필 전체와 behaviorModel을 추가했고, P3가 말하지 않은 특성(권한 불안)은 어느 응답자에게서 왔는지 근거에 명시했다.",
  "generatedBy": "claude-sonnet-4-5 (샘플 예시 데이터)",